{
  "$schema": "https://json-schema.org/draft/2020-12/schema",
  "title": "great_figure",
  "type": "object",
  "required": [
    "id",
    "name",
    "era",
    "nationality",
    "field",
    "worry_tags",
    "struggle",
    "bio_summary",
    "achievement",
    "quote",
    "quote_background",
    "fame_tier",
    "sources"
  ],
  "properties": {
    "id": {
      "type": "string",
      "description": "スラッグ形式の主キー"
    },
    "name": {
      "type": "string",
      "description": "氏名（日本語表記）"
    },
    "name_en": {
      "type": "string",
      "description": "氏名（原語・英語表記）"
    },
    "era": {
      "type": "string",
      "description": "生没年。存命者は '1994–' 形式"
    },
    "nationality": {
      "type": "string"
    },
    "field": {
      "type": "string",
      "description": "分野。'大分類（小分類）' 形式"
    },
    "worry_tags": {
      "type": "array",
      "minItems": 1,
      "maxItems": 2,
      "items": {
        "enum": [
          "喜び／期待",
          "悲しみ",
          "怒り",
          "不安・恐れ",
          "疲労・無気力",
          "孤独",
          "迷い・混乱"
        ]
      }
    },
    "struggle": {
      "type": "string",
      "description": "抱えていた困難・葛藤（2〜3文）"
    },
    "bio_summary": {
      "type": "string",
      "description": "伝記要約（3〜5文）"
    },
    "achievement": {
      "type": "string",
      "description": "成し遂げたこと（2〜3文）"
    },
    "quote": {
      "type": "string",
      "description": "代表的な格言"
    },
    "quote_background": {
      "type": "string",
      "description": "格言の背景思想（1〜2文）"
    },
    "quote_source_status": {
      "enum": [
        "検証済",
        "要確認",
        "誤帰属"
      ],
      "description": "検証済=一次/信頼できる二次資料で確認、要確認=一次出典未特定、誤帰属=本人の言葉でないと判明（quote_alt を使うこと）"
    },
    "fame_tier": {
      "enum": [
        "超有名",
        "知る人ぞ知る",
        "マイナー"
      ],
      "description": "日本の一般層における人物としての認知度"
    },
    "sources": {
      "type": "array",
      "minItems": 1,
      "items": {
        "type": "string",
        "format": "uri"
      }
    },
    "notes": {
      "type": "string",
      "description": "誤帰属注意・留意事項"
    },
    "quote_alt": {
      "type": "string",
      "description": "quote が誤帰属の場合に使う代替引用"
    }
  }
}
