[
  {
    "id": "ohtani-shohei",
    "name": "大谷 翔平",
    "name_en": "Shohei Ohtani",
    "era": "1994–",
    "nationality": "日本",
    "field": "スポーツ（野球）",
    "worry_tags": [
      "喜び／期待",
      "不安・恐れ"
    ],
    "struggle": "投手と打者の二刀流は「どちらも中途半端に終わる」と球界内外から長く否定され続け、前例のない道を一人で証明するしかなかった。2018年と2023年に右肘の大手術を受け、投手としてのキャリアが終わるかもしれないという恐れと、年単位のリハビリに向き合った。",
    "bio_summary": "岩手県奥州市生まれ。花巻東高校で投打二刀流として注目され、2013年に北海道日本ハムファイターズへ入団。2018年ロサンゼルス・エンゼルスでMLBデビューし新人王。2021年・2023年にア・リーグMVP。2024年にロサンゼルス・ドジャースへ移籍し、同年史上初の「50本塁打・50盗塁」を達成。2025年は投手として復帰しつつ4度目の満票MVPを獲得、チームのワールドシリーズ連覇に貢献した。",
    "achievement": "近代MLBで絶えていた本格的な二刀流を成立させ、投打の両方でリーグ最高水準の成績を同時に残した。2024年に前人未到の50本塁打・50盗塁を記録し、2021・2023・2024・2025年と満票でMVPを受賞している。",
    "quote": "憧れるのをやめましょう。",
    "quote_background": "2023年WBC決勝・米国戦の直前、円陣で味方に語った言葉。憧れの対象として相手を見ている限り超えられない、対等な競争者として立てという、自己認識の切り替えを促す発想から出ている。",
    "fame_tier": "超有名",
    "sources": [
      "https://www.mlb.com/ja/news/reporters-view-shohei-ohtani-fourth-mvp",
      "https://ja.wikipedia.org/wiki/%E5%A4%A7%E8%B0%B7%E7%BF%94%E5%B9%B3"
    ],
    "quote_source_status": "検証済"
  },
  {
    "id": "gandhi",
    "name": "マハトマ・ガンディー",
    "name_en": "Mohandas Karamchand Gandhi",
    "era": "1869–1948",
    "nationality": "インド",
    "field": "政治／人権運動",
    "worry_tags": [
      "怒り",
      "迷い・混乱"
    ],
    "struggle": "南アフリカで一等車から放り出された人種差別体験が原点にあり、理不尽への強い怒りを抱えた。しかしその怒りを暴力に転化しない方法を生涯かけて模索し、独立後はヒンドゥー・ムスリム間の殺し合いを止められない無力感と、同胞からの反発の中で孤立した。",
    "bio_summary": "英領インドのポールバンダルに生まれ、ロンドンで法律を学ぶ。南アフリカで弁護士として働くうち人種差別に直面し、非暴力抵抗（サティヤーグラハ）の思想を形成した。1915年に帰国後、インド国民会議を率いて塩の行進や非協力運動を展開。イギリスからの独立を主導したが、印パ分離をめぐる宗教対立の激化に苦しみ、1948年にヒンドゥー至上主義者に暗殺された。",
    "achievement": "非暴力・不服従を大衆的な政治手法として確立し、インド独立を実現に導いた。その方法論はキング牧師やマンデラをはじめ、20世紀の公民権運動・反アパルトヘイト運動に決定的な影響を与えた。",
    "quote": "もし我々が自分自身を変えることができれば、世界の趨勢もまた変わる。人が自分の本性を変えれば、世界の彼に対する態度も変わるのだ。",
    "quote_background": "1913年の機関紙『Indian Opinion』掲載。社会を外から糾弾するより、まず自己を律することが世界を動かすという自己変革優先の思想から出ている。",
    "fame_tier": "超有名",
    "sources": [
      "https://professorbuzzkill.com/2017/01/09/gandhi-be-the-change-you-wish-to-see-in-the-world/",
      "https://josephranseth.com/gandhi-didnt-say-be-the-change-you-want-to-see-in-the-world/"
    ],
    "quote_source_status": "検証済",
    "notes": "英語圏で広く流通する簡略化された格言（1913年の文章の要約が独り歩きしたもの）はガンディー本人の発言記録が存在しないため、本DBでは採用していない。"
  },
  {
    "id": "ramanujan",
    "name": "シュリニヴァーサ・ラマヌジャン",
    "name_en": "Srinivasa Ramanujan",
    "era": "1887–1920",
    "nationality": "インド",
    "field": "科学（数学）",
    "worry_tags": [
      "孤独",
      "不安・恐れ"
    ],
    "struggle": "正規の数学教育を受けられず、大学は数学以外の科目で落第。独学で書き溜めた定理を誰も理解せず、港湾事務所の事務員として貧困の中で研究を続けた。渡英後は菜食の維持が困難な戦時下の英国で健康を崩し、文化的孤立と病に苦しんだ。",
    "bio_summary": "南インドのエロードに生まれる。少年期に古い数学公式集を独学し、独自の記法で膨大な定理を書き溜めた。1913年、英国の数学者G.H.ハーディに手紙を送り、その内容に驚嘆したハーディの招きで1914年に渡英。ケンブリッジで共同研究を行い王立協会フェローに選ばれたが、病を得て1919年に帰国し、翌1920年に32歳で没した。",
    "achievement": "分割数の漸近公式、モックシータ関数、ラマヌジャン素数など、証明抜きで直観的に到達した約3900の結果を残した。その多くは死後数十年を経て正しさが証明され、現在も数論・弦理論の研究に使われている。",
    "quote": "私にとって、方程式は神の思考を表現しない限り何の意味も持たない。",
    "quote_background": "彼が家族の女神ナーマギリの啓示として数式を得ると語っていた宗教的世界観に由来する。数学を発見ではなく啓示として受け取る態度を示す。",
    "fame_tier": "知る人ぞ知る",
    "sources": [
      "https://www.oxfordreference.com/display/10.1093/acref/9780191826719.001.0001/q-oro-ed4-00008729",
      "https://arxiv.org/pdf/1707.03379"
    ],
    "quote_source_status": "要確認",
    "notes": "格言はロバート・カニーゲル『The Man Who Knew Infinity』経由で広まった伝聞。ラマヌジャン自身の手稿・書簡での一次出典は特定できていない（要確認）。"
  },
  {
    "id": "marie-curie",
    "name": "マリー・キュリー",
    "name_en": "Marie Skłodowska-Curie",
    "era": "1867–1934",
    "nationality": "ポーランド → フランス",
    "field": "科学（物理学・化学）",
    "worry_tags": [
      "悲しみ",
      "怒り"
    ],
    "struggle": "ロシア支配下のポーランドで女性が大学に進めず、地下大学と住み込み家庭教師で学費を稼いだ。1906年に夫ピエールを交通事故で急死させ、深い喪失の中で研究を引き継いだ。女性であることを理由にフランス科学アカデミー入会を拒まれ、私生活を暴くスキャンダル報道にも晒された。",
    "bio_summary": "ワルシャワに生まれ、24歳でパリのソルボンヌへ留学。ピエール・キュリーと結婚し、ウラン鉱石ピッチブレンドから新元素を探す共同研究に着手した。1898年にポロニウムとラジウムを発見し、1903年にノーベル物理学賞を受賞。夫の死後もラジウム研究を継続し、1911年にノーベル化学賞を単独受賞した。第一次大戦では移動X線車を戦地に送り、晩年は長年の被曝が原因とみられる再生不良性貧血で没した。",
    "achievement": "放射能（radioactivity）という概念を確立し、ポロニウム・ラジウムの2元素を発見した。異なる2分野でノーベル賞を受賞した史上唯一の人物であり、第一次大戦では約100台の移動X線設備を組織して負傷兵の診断に貢献した。",
    "quote": "人生において恐れるべきものは何もない。ただ理解すべきものがあるだけだ。",
    "quote_background": "未知を恐怖の対象ではなく分析の対象として扱う、彼女の徹底した実証主義的態度を要約した言葉とされる。",
    "fame_tier": "超有名",
    "sources": [
      "https://www.nobelprize.org/prizes/chemistry/1911/marie-curie/biographical/",
      "https://www.nobelprize.org/prizes/chemistry/1911/marie-curie/facts/"
    ],
    "quote_source_status": "要確認",
    "notes": "格言の初出として確認できるのは1973年の書籍 Melvin A. Benarde 'Our Precarious Habitat' 巻頭引用で、キュリー本人の著作・書簡での一次出典は未特定（要確認）。"
  },
  {
    "id": "helen-keller",
    "name": "ヘレン・ケラー",
    "name_en": "Helen Keller",
    "era": "1880–1968",
    "nationality": "アメリカ",
    "field": "社会運動／文筆",
    "worry_tags": [
      "怒り",
      "孤独"
    ],
    "struggle": "生後19か月の高熱で視覚と聴覚を失い、言葉を持たないまま7歳まで暗闇と沈黙の中で癇癪を爆発させて過ごした。言語を獲得した後も、障害者は同情の対象として扱われ、社会運動家としての政治的主張は「盲目だから騙されている」と新聞に嘲笑された。",
    "bio_summary": "アラバマ州タスカンビア生まれ。1歳半で視聴覚を失うが、1887年に家庭教師アン・サリヴァンと出会い、手のひらへの指文字で「水」という語と物の対応を理解して言語世界に入った。ラドクリフ・カレッジを卒業し、著書『わたしの生涯』を出版。以後は世界各地で講演し、障害者福祉のみならず女性参政権や労働者の権利も訴えた。1937年・1948年・1955年に来日している。",
    "achievement": "重複障害者として初めて大学の学士号を取得し、視覚障害者支援団体（現アメリカ盲人援護協会）の活動を通じて世界の障害者福祉制度の整備を推し進めた。著述と講演によって、障害を「克服する個人の物語」から「社会が変わるべき課題」へと議論を押し上げた。",
    "quote": "一人でできることは少ない。共になら、多くのことができる。",
    "quote_background": "1920年代にサリヴァンと巡演したボードビル公演の口上に含まれていた一節。個人の努力を称揚するのではなく、連帯こそが力だという彼女の社会運動家としての立場を示す。",
    "fame_tier": "超有名",
    "sources": [
      "https://quoteinvestigator.com/2014/04/21/together/",
      "https://afb.org/about-afb/history/helen-keller/helen-keller-quotes/helen-keller-quotes-progress"
    ],
    "quote_source_status": "検証済"
  },
  {
    "id": "steve-jobs",
    "name": "スティーブ・ジョブズ",
    "name_en": "Steve Jobs",
    "era": "1955–2011",
    "nationality": "アメリカ",
    "field": "ビジネス／テクノロジー",
    "worry_tags": [
      "迷い・混乱",
      "怒り"
    ],
    "struggle": "生後まもなく養子に出された出自と、リード大学中退後の進路の迷いを長く抱えた。1985年には自ら創業したアップルを役員会との対立の末に追放され、公然と失敗者として扱われる屈辱を味わった。2003年に膵臓の神経内分泌腫瘍が見つかり、死を意識しながら経営を続けた。",
    "bio_summary": "サンフランシスコに生まれ、養父母のもとシリコンバレーで育つ。1976年にスティーブ・ウォズニアックらとアップルを創業しApple IIを成功させたが、1985年に社を追われる。NeXTを設立し、並行して買収したピクサーで『トイ・ストーリー』を成功させた。1996年のNeXT買収に伴いアップルへ復帰し、iMac・iPod・iPhone・iPadを世に出して同社を再建。2011年に闘病の末56歳で没した。",
    "achievement": "パーソナルコンピュータ、音楽配信、スマートフォン、タブレットという4つの産業の形を作り替えた。2007年のiPhoneは携帯電話をソフトウェア中心の汎用端末へと再定義し、以後のモバイル産業全体の前提を書き換えた。",
    "quote": "ハングリーであれ。愚か者であれ。（Stay hungry. Stay foolish.）",
    "quote_background": "2005年スタンフォード大学卒業式スピーチの結語。1970年代のカタログ誌『Whole Earth Catalog』最終号の裏表紙にあった言葉を引用したもので、満ち足りることと分別を持つことの両方を警戒する反権威的な精神から出ている。",
    "fame_tier": "超有名",
    "sources": [
      "https://news.stanford.edu/stories/2005/06/youve-got-find-love-jobs-says",
      "https://stevejobsarchive.com/stories/stay-hungry-stay-foolish"
    ],
    "quote_source_status": "検証済"
  },
  {
    "id": "honda-soichiro",
    "name": "本田 宗一郎",
    "name_en": "Soichiro Honda",
    "era": "1906–1991",
    "nationality": "日本",
    "field": "ビジネス／技術",
    "worry_tags": [
      "喜び／期待",
      "疲労・無気力"
    ],
    "struggle": "高等小学校卒で自動車修理工から出発し、学歴のなさゆえに技術者として軽んじられた。戦中に手がけたピストンリング事業は品質不良と空襲、そして三河地震での工場倒壊で壊滅し、戦後にほぼ無一文から再出発している。「失敗の連続」と自称するほど試作と挫折を繰り返した。",
    "bio_summary": "静岡県磐田郡（現・浜松市）の鍛冶屋の子に生まれ、15歳で東京の自動車修理工場に丁稚奉公。独立して浜松で修理業を営み、ピストンリング製造に転じるが戦災で失う。1946年に本田技術研究所を設立し、自転車用補助エンジンから二輪車へ進出。1948年に本田技研工業を創業し、藤沢武夫と組んでスーパーカブを世界的商品に育てた。1973年に社長を退き、1991年に84歳で没した。",
    "achievement": "スーパーカブを世界で最も生産された二輪車に育て上げ、ホンダを世界最大級の二輪メーカーにした。1961年のマン島TTレースで日本メーカーとして初の完全制覇を果たし、1964年からのF1参戦でも技術力を証明。四輪ではCVCCエンジンで、当時世界一厳しいとされた米マスキー法の排ガス規制を最初にクリアした。",
    "quote": "私の現在が成功というのなら、私の過去はみんな失敗が土台づくりをしていることになる。仕事は全部失敗の連続である。",
    "quote_background": "試作と失敗の反復こそが技術開発の実体であり、成功はその副産物にすぎないという、現場出身の技術者としての経験主義から出ている。",
    "fame_tier": "超有名",
    "sources": [
      "https://global.honda/jp/guide/hondaism.html",
      "https://global.honda/jp/guide/history-digest/75years-history/chapter1/section1/"
    ],
    "quote_source_status": "要確認",
    "notes": "格言は多数の名言サイトに掲載されるが、講演録・著書などの一次出典を特定できず（要確認）。確実な一次資料としては本人の著書『得手に帆をあげて』（1962年）がある。"
  },
  {
    "id": "van-gogh",
    "name": "フィンセント・ファン・ゴッホ",
    "name_en": "Vincent van Gogh",
    "era": "1853–1890",
    "nationality": "オランダ",
    "field": "芸術（絵画）",
    "worry_tags": [
      "孤独",
      "迷い・混乱"
    ],
    "struggle": "画商・教師・伝道師と職を転々とし、27歳でようやく画家を志すまで自分の居場所を見つけられなかった。生前に売れた作品はごくわずかで、生活費のすべてを弟テオの仕送りに頼る負い目を抱え続けた。アルルでのゴーギャンとの共同生活の破綻後は発作を繰り返し、療養院に入りながら制作した。",
    "bio_summary": "オランダ南部の牧師の家に生まれ、画商の店員や炭鉱地帯の伝道師を経て1880年に画家を志す。初期は暗い色調で農民を描き、1886年にパリへ出て印象派と浮世絵に触れて色彩が一変した。1888年に南仏アルルへ移り《ひまわり》などを集中的に制作するが、ゴーギャンとの生活が破綻して耳を切る事件を起こす。サン=レミの療養院を経てオーヴェールに移り、1890年に37歳で銃創により没した。",
    "achievement": "わずか10年ほどの画業で約2100点（うち油彩約860点）を残し、色彩と筆触そのものに感情を担わせる表現を確立した。その手法はフォーヴィスムやドイツ表現主義の出発点となり、20世紀絵画の方向を決定づけた。",
    "quote": "もし心の中で「お前は画家ではない」という声が聞こえたら、何としても絵を描け。そうすればその声は黙る。ただし、描くことによってのみだ。",
    "quote_background": "1883年10月28日、弟テオへの書簡（ファン・ゴッホ美術館書簡番号400）より。無力感に対して行動で応じるという、彼自身が繰り返し実践した自己説得の型を示す。",
    "fame_tier": "超有名",
    "sources": [
      "https://quoteinvestigator.com/2026/06/24/voice-paint/",
      "https://www.vangoghletters.org/vg/letters/let400/letter.html"
    ],
    "quote_source_status": "検証済"
  },
  {
    "id": "beethoven",
    "name": "ルートヴィヒ・ヴァン・ベートーヴェン",
    "name_en": "Ludwig van Beethoven",
    "era": "1770–1827",
    "nationality": "ドイツ（神聖ローマ帝国ボン）",
    "field": "音楽（作曲）",
    "worry_tags": [
      "不安・恐れ",
      "孤独"
    ],
    "struggle": "20代後半から難聴が始まり、音楽家として最も失ってはならない聴覚を徐々に奪われた。1802年には絶望のあまり遺書を書くほど追い詰められ、人付き合いを避けて孤立した。晩年はほぼ完全に聴力を失い、筆談帳を介してしか他人と会話できなかった。",
    "bio_summary": "ボンの宮廷音楽家の家に生まれ、酒におぼれる父から厳しい訓練を受けた。1792年にウィーンへ移りハイドンらに学び、ピアニスト・作曲家として名声を得る。1790年代末から進行した難聴に苦しみ、1802年に「ハイリゲンシュタットの遺書」を記すが自死を思いとどまり創作を続けた。中期には《英雄》《運命》など革新的な交響曲を発表し、聴力を完全に失った晩年に《第九》や後期弦楽四重奏曲を書き上げ、1827年にウィーンで没した。",